品牌,ASIN,url,商品标题,价格,评分,评论数,核心卖点,优点评炼,缺点评炼,综合分析,竞品定位
doogee,B0DHZY5SLH,https://www.amazon.com/dp/B0DHZY5SLH,"Ulefone Armor 27T Plus 4G Rugged Phone, Thermal Imaging 64MP+50MP Camera, 24GB+256GB MTK Helio G99, 10600mAh(33W), 30W Wireless Charging, 6.78"" FHD+ 120Hz Corning Gorilla Screen, IP68/69K, Android 15 | FLIR 3.5 Thermal, 30W QI Charging, 33W Fast Charging, 64MP Night Vision, 50MP Main Camera, 32MP Front Camera","TWD13,162.49",3.9 out of 5 stars,(124),,,,,
doogee,B0FRMRZDFM,https://www.amazon.com/dp/B0FRMRZDFM,"NUU B40 5G, Cell Phone, Unlocked, Dual SIM, Dual AMOLED Display, 120Hz, 64 MP Camera, 8GB+256GB, Android 15, US Version, US 1 Yr Warranty, Midnight Grey","TWD7,834.69",4.3 out of 5 stars,(84),,,,,
doogee,B0FX4KDC9R,https://www.amazon.com/dp/B0FX4KDC9R,"Blackview Fort 2 Rugged Phone Android 16, 10.7mm Ultra-Thin Rugged Smartphone Unlocked, 24GB + 128GB/2TB 6.56”HD+90Hz Large Dispaly, 4G T-Mobile Dual SIM IP69K Waterproof 16MP+13MP Camera, NFC/OTG/GPS","TWD7,521.29",4.4 out of 5 stars,(42),,,,,
doogee,B0GSLGMFKW,https://www.amazon.com/dp/B0GSLGMFKW,Mr.Shield Screen Protector compatible with Doogee Blade 10 Power /10 Energy / 10 Pro Energy / 10 Ultra Energy [Tempered Glass] [3-PACK] [Japan Glass with 9H Hardness],TWD280.49,5.0 out of 5 stars,(1),,,,,
doogee,B0G4DJ6XH4,https://www.amazon.com/dp/B0G4DJ6XH4,"45W Super Fast Charger Type C, for Doogee Tab U13/U12/U11/U11 Pro/U10/U10 Pro/Tab E3+/E3 Pro/G6/A9 Pro+/T36/T30E/T40/V Pad 5G Charger Block with 6.6FT Type C Charging Cord High Speed Charger",TWD407.11,4.0 out of 5 stars,(4),,,,,
